{
  "$schema": "https://json-schema.org/draft/2020-12/schema",
  "type": "object",
  "properties": {
    "schemaVersion": {
      "type": "string",
      "const": "1.0.0"
    },
    "id": {
      "type": "string",
      "pattern": "^[a-zA-Z0-9][a-zA-Z0-9._-]*$"
    },
    "version": {
      "type": "string",
      "pattern": "^\\d+\\.\\d+\\.\\d+$"
    },
    "purpose": {
      "type": "string",
      "enum": [
        "exploratory",
        "release"
      ]
    },
    "scorePolicy": {
      "type": "string",
      "const": "all-mandatory-1.0.0"
    },
    "promptVersion": {
      "type": "string",
      "enum": [
        "criterion-1.0.0",
        "criterion-1.1.0"
      ]
    },
    "review": {
      "type": "object",
      "properties": {
        "status": {
          "type": "string",
          "enum": [
            "draft",
            "approved",
            "rejected"
          ]
        },
        "reviewer": {
          "anyOf": [
            {
              "type": "string",
              "minLength": 1
            },
            {
              "type": "null"
            }
          ]
        },
        "reviewedAt": {
          "anyOf": [
            {
              "type": "string",
              "format": "date-time",
              "pattern": "^(?:(?:\\d\\d[2468][048]|\\d\\d[13579][26]|\\d\\d0[48]|[02468][048]00|[13579][26]00)-02-29|\\d{4}-(?:(?:0[13578]|1[02])-(?:0[1-9]|[12]\\d|3[01])|(?:0[469]|11)-(?:0[1-9]|[12]\\d|30)|(?:02)-(?:0[1-9]|1\\d|2[0-8])))T(?:(?:[01]\\d|2[0-3]):[0-5]\\d:[0-5]\\d(?:\\.\\d+)?(?:Z|([+-](?:[01]\\d|2[0-3]):[0-5]\\d)))$"
            },
            {
              "type": "null"
            }
          ]
        },
        "notes": {
          "type": "string"
        }
      },
      "required": [
        "status",
        "reviewer",
        "reviewedAt",
        "notes"
      ],
      "additionalProperties": false
    },
    "calibrationHash": {
      "anyOf": [
        {
          "type": "string",
          "pattern": "^[a-f0-9]{64}$"
        },
        {
          "type": "null"
        }
      ]
    },
    "limits": {
      "type": "object",
      "properties": {
        "maxRequests": {
          "type": "integer",
          "exclusiveMinimum": 0,
          "maximum": 200
        },
        "maxRequestBytes": {
          "type": "integer",
          "exclusiveMinimum": 0,
          "maximum": 100000
        },
        "maxOutputTokensPerRequest": {
          "type": "integer",
          "exclusiveMinimum": 0,
          "maximum": 8000
        },
        "maxInputTokens": {
          "type": "integer",
          "exclusiveMinimum": 0,
          "maximum": 9007199254740991
        },
        "maxOutputTokens": {
          "type": "integer",
          "exclusiveMinimum": 0,
          "maximum": 9007199254740991
        },
        "maxCostUsd": {
          "type": "number",
          "exclusiveMinimum": 0
        },
        "timeoutMs": {
          "type": "integer",
          "exclusiveMinimum": 0,
          "maximum": 60000
        },
        "maxDurationMs": {
          "type": "integer",
          "exclusiveMinimum": 0,
          "maximum": 600000
        }
      },
      "required": [
        "maxRequests",
        "maxRequestBytes",
        "maxOutputTokensPerRequest",
        "maxInputTokens",
        "maxOutputTokens",
        "maxCostUsd",
        "timeoutMs",
        "maxDurationMs"
      ],
      "additionalProperties": false
    },
    "judges": {
      "minItems": 1,
      "maxItems": 2,
      "type": "array",
      "items": {
        "type": "object",
        "properties": {
          "id": {
            "type": "string",
            "pattern": "^[a-zA-Z0-9][a-zA-Z0-9._-]*$"
          },
          "transport": {
            "type": "string",
            "enum": [
              "direct",
              "gateway"
            ]
          },
          "model": {
            "anyOf": [
              {
                "type": "string",
                "minLength": 1
              },
              {
                "type": "null"
              }
            ]
          },
          "parameters": {
            "type": "object",
            "properties": {
              "temperature": {
                "type": "number",
                "minimum": 0,
                "maximum": 2
              },
              "topP": {
                "type": "number",
                "minimum": 0,
                "maximum": 1
              },
              "seed": {
                "type": "integer",
                "minimum": -9007199254740991,
                "maximum": 9007199254740991
              },
              "reasoning": {
                "type": "string",
                "enum": [
                  "provider-default",
                  "none",
                  "minimal",
                  "low",
                  "medium",
                  "high",
                  "xhigh"
                ]
              }
            },
            "additionalProperties": false
          },
          "pricing": {
            "anyOf": [
              {
                "type": "object",
                "properties": {
                  "version": {
                    "type": "string",
                    "pattern": "^\\d+\\.\\d+\\.\\d+$"
                  },
                  "asOf": {
                    "type": "string",
                    "format": "date-time",
                    "pattern": "^(?:(?:\\d\\d[2468][048]|\\d\\d[13579][26]|\\d\\d0[48]|[02468][048]00|[13579][26]00)-02-29|\\d{4}-(?:(?:0[13578]|1[02])-(?:0[1-9]|[12]\\d|3[01])|(?:0[469]|11)-(?:0[1-9]|[12]\\d|30)|(?:02)-(?:0[1-9]|1\\d|2[0-8])))T(?:(?:[01]\\d|2[0-3]):[0-5]\\d:[0-5]\\d(?:\\.\\d+)?(?:Z|([+-](?:[01]\\d|2[0-3]):[0-5]\\d)))$"
                  },
                  "inputUsdPerMillion": {
                    "type": "number",
                    "minimum": 0
                  },
                  "outputUsdPerMillion": {
                    "type": "number",
                    "minimum": 0
                  }
                },
                "required": [
                  "version",
                  "asOf",
                  "inputUsdPerMillion",
                  "outputUsdPerMillion"
                ],
                "additionalProperties": false
              },
              {
                "type": "null"
              }
            ]
          }
        },
        "required": [
          "id",
          "transport",
          "model",
          "parameters",
          "pricing"
        ],
        "additionalProperties": false
      }
    }
  },
  "required": [
    "schemaVersion",
    "id",
    "version",
    "purpose",
    "scorePolicy",
    "promptVersion",
    "review",
    "calibrationHash",
    "limits",
    "judges"
  ],
  "additionalProperties": false
}
