{
  "schemaVersion": "1.0.0",
  "id": "minimax-exploratory",
  "version": "1.0.0",
  "purpose": "exploratory",
  "scorePolicy": "all-mandatory-1.0.0",
  "promptVersion": "criterion-1.0.0",
  "review": {
    "status": "draft",
    "reviewer": null,
    "reviewedAt": null,
    "notes": "Owner-selected exploratory judge (2026-10-04): minimax/minimax-m3 through the AI Gateway, pricing frozen from the gateway published standard tier on 2026-10-04. Single judge, uncalibrated: exploratory only."
  },
  "calibrationHash": null,
  "limits": {
    "maxRequests": 28,
    "maxRequestBytes": 24000,
    "maxOutputTokensPerRequest": 2000,
    "maxInputTokens": 100000,
    "maxOutputTokens": 16000,
    "maxCostUsd": 0.25,
    "timeoutMs": 30000,
    "maxDurationMs": 300000
  },
  "judges": [
    {
      "id": "minimax",
      "transport": "gateway",
      "model": "minimax/minimax-m3",
      "parameters": {
        "temperature": 0
      },
      "pricing": {
        "version": "2026.10.04",
        "asOf": "2026-10-04T00:00:00Z",
        "inputUsdPerMillion": 0.3,
        "outputUsdPerMillion": 1.2
      }
    }
  ]
}
